<?xml version="1.0" encoding="utf-8"?>
<!DOCTYPE monodoc SYSTEM "http://www.go-mono.org/monodoc.dtd">
<monodoc language="en">
    <class name="System.MarshalByRefObject" assembly="corlib">
        <summary>TODO</summary>
        <remarks>TODO</remarks>
        <method name="InitializeLifetimeService">
            <summary>TODO</summary>
            <remarks>TODO</remarks>
            <returns>TODO</returns>
        </method>
        <method name="GetLifetimeService">
            <summary>TODO</summary>
            <remarks>TODO</remarks>
            <returns>TODO</returns>
        </method>
        <method name="CreateObjRef(System.Type)">
            <summary>TODO</summary>
            <remarks>TODO</remarks>
            <param name="type">TODO</param>
            <returns>TODO</returns>
        </method>
    </class>
</monodoc>