<?xml version="1.0" encoding="utf-8"?>
<!DOCTYPE monodoc SYSTEM "http://www.go-mono.org/monodoc.dtd">
<monodoc language="en">
    <class name="System.Xml.Schema.XmlSchemaContentModel" assembly="System.Xml">
        <summary>TODO</summary>
        <remarks>TODO</remarks>
        <property name="Content">
            <summary>TODO</summary>
            <remarks>TODO</remarks>
            <value>TODO</value>
        </property>
    </class>
</monodoc>