<?xml version="1.0" encoding="utf-8"?>
<!DOCTYPE monodoc SYSTEM "http://www.go-mono.org/monodoc.dtd">
<monodoc language="en">
    <class name="System.Security.Cryptography.DSASignatureFormatter" assembly="corlib">
        <summary>TODO</summary>
        <remarks>TODO</remarks>
        <constructor name="DSASignatureFormatter">
            <summary>TODO</summary>
            <remarks>TODO</remarks>
        </constructor>
        <constructor name="DSASignatureFormatter(System.Security.Cryptography.AsymmetricAlgorithm)">
            <summary>TODO</summary>
            <remarks>TODO</remarks>
            <param name="key">TODO</param>
        </constructor>
        <method name="CreateSignature(System.Byte[])">
            <summary>TODO</summary>
            <remarks>TODO</remarks>
            <param name="rgbHash">TODO</param>
            <returns>TODO</returns>
        </method>
        <method name="SetKey(System.Security.Cryptography.AsymmetricAlgorithm)">
            <summary>TODO</summary>
            <remarks>TODO</remarks>
            <param name="key">TODO</param>
            <returns>TODO</returns>
        </method>
        <method name="SetHashAlgorithm(System.String)">
            <summary>TODO</summary>
            <remarks>TODO</remarks>
            <param name="strName">TODO</param>
            <returns>TODO</returns>
        </method>
    </class>
</monodoc>