<?xml version="1.0" encoding="utf-8"?>
<!DOCTYPE monodoc SYSTEM "http://www.go-mono.org/monodoc.dtd">
<monodoc language="en">
    <class name="System.Reflection.ParameterInfo" assembly="corlib">
        <summary>TODO</summary>
        <remarks>TODO</remarks>
        <property name="ParameterType">
            <summary>TODO</summary>
            <remarks>TODO</remarks>
            <value>TODO</value>
        </property>
        <property name="Attributes">
            <summary>TODO</summary>
            <remarks>TODO</remarks>
            <value>TODO</value>
        </property>
        <property name="DefaultValue">
            <summary>TODO</summary>
            <remarks>TODO</remarks>
            <value>TODO</value>
        </property>
        <property name="IsIn">
            <summary>TODO</summary>
            <remarks>TODO</remarks>
            <value>TODO</value>
        </property>
        <property name="IsLcid">
            <summary>TODO</summary>
            <remarks>TODO</remarks>
            <value>TODO</value>
        </property>
        <property name="IsOptional">
            <summary>TODO</summary>
            <remarks>TODO</remarks>
            <value>TODO</value>
        </property>
        <property name="IsOut">
            <summary>TODO</summary>
            <remarks>TODO</remarks>
            <value>TODO</value>
        </property>
        <property name="IsRetval">
            <summary>TODO</summary>
            <remarks>TODO</remarks>
            <value>TODO</value>
        </property>
        <property name="Member">
            <summary>TODO</summary>
            <remarks>TODO</remarks>
            <value>TODO</value>
        </property>
        <property name="Name">
            <summary>TODO</summary>
            <remarks>TODO</remarks>
            <value>TODO</value>
        </property>
        <property name="Position">
            <summary>TODO</summary>
            <remarks>TODO</remarks>
            <value>TODO</value>
        </property>
        <method name="IsDefined(System.Type, System.Boolean)">
            <summary>TODO</summary>
            <remarks>TODO</remarks>
            <param name="attributeType">TODO</param>
            <param name="inherit">TODO</param>
            <returns>TODO</returns>
        </method>
        <method name="GetCustomAttributes(System.Type, System.Boolean)">
            <summary>TODO</summary>
            <remarks>TODO</remarks>
            <param name="attributeType">TODO</param>
            <param name="inherit">TODO</param>
            <returns>TODO</returns>
        </method>
        <method name="GetCustomAttributes(System.Boolean)">
            <summary>TODO</summary>
            <remarks>TODO</remarks>
            <param name="inherit">TODO</param>
            <returns>TODO</returns>
        </method>
    </class>
</monodoc>