<?xml version="1.0" encoding="utf-8"?>
<!DOCTYPE monodoc SYSTEM "http://www.go-mono.org/monodoc.dtd">
<monodoc language="en">
    <class name="System.Threading.ThreadPool" assembly="corlib">
        <summary>TODO</summary>
        <remarks>TODO</remarks>
        <method name="BindHandle(System.IntPtr)">
            <summary>TODO</summary>
            <remarks>TODO</remarks>
            <param name="osHandle">TODO</param>
            <returns>TODO</returns>
        </method>
        <method name="QueueUserWorkItem(System.Threading.WaitCallback)">
            <summary>TODO</summary>
            <remarks>TODO</remarks>
            <param name="callback">TODO</param>
            <returns>TODO</returns>
        </method>
        <method name="QueueUserWorkItem(System.Threading.WaitCallback, System.Object)">
            <summary>TODO</summary>
            <remarks>TODO</remarks>
            <param name="callback">TODO</param>
            <param name="state">TODO</param>
            <returns>TODO</returns>
        </method>
        <method name="RegisterWaitForSingleObject(System.Threading.WaitHandle, System.Threading.WaitOrTimerCallback, System.Object, System.Int32, System.Boolean)">
            <summary>TODO</summary>
            <remarks>TODO</remarks>
            <param name="waitObject">TODO</param>
            <param name="callback">TODO</param>
            <param name="state">TODO</param>
            <param name="millisecondsTimeOutInterval">TODO</param>
            <param name="executeOnlyOnce">TODO</param>
            <returns>TODO</returns>
        </method>
        <method name="RegisterWaitForSingleObject(System.Threading.WaitHandle, System.Threading.WaitOrTimerCallback, System.Object, System.Int64, System.Boolean)">
            <summary>TODO</summary>
            <remarks>TODO</remarks>
            <param name="waitObject">TODO</param>
            <param name="callback">TODO</param>
            <param name="state">TODO</param>
            <param name="millisecondsTimeOutInterval">TODO</param>
            <param name="executeOnlyOnce">TODO</param>
            <returns>TODO</returns>
        </method>
        <method name="RegisterWaitForSingleObject(System.Threading.WaitHandle, System.Threading.WaitOrTimerCallback, System.Object, System.TimeSpan, System.Boolean)">
            <summary>TODO</summary>
            <remarks>TODO</remarks>
            <param name="waitObject">TODO</param>
            <param name="callback">TODO</param>
            <param name="state">TODO</param>
            <param name="timeout">TODO</param>
            <param name="executeOnlyOnce">TODO</param>
            <returns>TODO</returns>
        </method>
        <method name="RegisterWaitForSingleObject(System.Threading.WaitHandle, System.Threading.WaitOrTimerCallback, System.Object, System.UInt32, System.Boolean)">
            <summary>TODO</summary>
            <remarks>TODO</remarks>
            <param name="waitObject">TODO</param>
            <param name="callback">TODO</param>
            <param name="state">TODO</param>
            <param name="millisecondsTimeOutInterval">TODO</param>
            <param name="executeOnlyOnce">TODO</param>
            <returns>TODO</returns>
        </method>
        <method name="UnsafeQueueUserWorkItem(System.Threading.WaitCallback, System.Object)">
            <summary>TODO</summary>
            <remarks>TODO</remarks>
            <param name="callback">TODO</param>
            <param name="state">TODO</param>
            <returns>TODO</returns>
        </method>
        <method name="UnsafeRegisterWaitForSingleObject(System.Threading.WaitHandle, System.Threading.WaitOrTimerCallback, System.Object, System.Int32, System.Boolean)">
            <summary>TODO</summary>
            <remarks>TODO</remarks>
            <param name="waitObject">TODO</param>
            <param name="callback">TODO</param>
            <param name="state">TODO</param>
            <param name="millisecondsTimeOutInterval">TODO</param>
            <param name="executeOnlyOnce">TODO</param>
            <returns>TODO</returns>
        </method>
        <method name="UnsafeRegisterWaitForSingleObject(System.Threading.WaitHandle, System.Threading.WaitOrTimerCallback, System.Object, System.Int64, System.Boolean)">
            <summary>TODO</summary>
            <remarks>TODO</remarks>
            <param name="waitObject">TODO</param>
            <param name="callback">TODO</param>
            <param name="state">TODO</param>
            <param name="millisecondsTimeOutInterval">TODO</param>
            <param name="executeOnlyOnce">TODO</param>
            <returns>TODO</returns>
        </method>
        <method name="UnsafeRegisterWaitForSingleObject(System.Threading.WaitHandle, System.Threading.WaitOrTimerCallback, System.Object, System.TimeSpan, System.Boolean)">
            <summary>TODO</summary>
            <remarks>TODO</remarks>
            <param name="waitObject">TODO</param>
            <param name="callback">TODO</param>
            <param name="state">TODO</param>
            <param name="timeout">TODO</param>
            <param name="executeOnlyOnce">TODO</param>
            <returns>TODO</returns>
        </method>
        <method name="UnsafeRegisterWaitForSingleObject(System.Threading.WaitHandle, System.Threading.WaitOrTimerCallback, System.Object, System.UInt32, System.Boolean)">
            <summary>TODO</summary>
            <remarks>TODO</remarks>
            <param name="waitObject">TODO</param>
            <param name="callback">TODO</param>
            <param name="state">TODO</param>
            <param name="millisecondsTimeOutInterval">TODO</param>
            <param name="executeOnlyOnce">TODO</param>
            <returns>TODO</returns>
        </method>
    </class>
</monodoc>