<?xml version="1.0" encoding="utf-8"?>
<!DOCTYPE monodoc SYSTEM "http://www.go-mono.org/monodoc.dtd">
<monodoc language="en">
    <class name="System.Security.Policy.Evidence" assembly="corlib">
        <summary>TODO</summary>
        <remarks>TODO</remarks>
        <constructor name="Evidence">
            <summary>TODO</summary>
            <remarks>TODO</remarks>
        </constructor>
        <method name="GetHostEnumerator">
            <summary>TODO</summary>
            <remarks>TODO</remarks>
            <returns>TODO</returns>
        </method>
    </class>
</monodoc>