<?xml version="1.0" encoding="utf-8"?>
<!DOCTYPE monodoc SYSTEM "http://www.go-mono.org/monodoc.dtd">
<monodoc language="en">
    <class name="System.Xml.XPath.XPathScanner" assembly="System.Xml">
        <summary>TODO</summary>
        <remarks>TODO</remarks>
        <constructor name="XPathScanner(System.String)">
            <summary>TODO</summary>
            <remarks>TODO</remarks>
            <param name="xpath">TODO</param>
        </constructor>
        <property name="TokenType">
            <summary>TODO</summary>
            <remarks>TODO</remarks>
            <value>TODO</value>
        </property>
        <property name="Value">
            <summary>TODO</summary>
            <remarks>TODO</remarks>
            <value>TODO</value>
        </property>
        <method name="Scan">
            <summary>TODO</summary>
            <remarks>TODO</remarks>
            <returns>TODO</returns>
        </method>
    </class>
</monodoc>