<?xml version="1.0" encoding="utf-8"?>
<!DOCTYPE monodoc SYSTEM "http://www.go-mono.org/monodoc.dtd">
<monodoc language="en">
    <class name="System.Reflection.AssemblyKeyNameAttribute" assembly="corlib">
        <summary>TODO</summary>
        <remarks>TODO</remarks>
        <constructor name="AssemblyKeyNameAttribute(System.String)">
            <summary>TODO</summary>
            <remarks>TODO</remarks>
            <param name="keyName">TODO</param>
        </constructor>
        <property name="KeyName">
            <summary>TODO</summary>
            <remarks>TODO</remarks>
            <value>TODO</value>
        </property>
    </class>
</monodoc>