<?xml version="1.0"?>
<!DOCTYPE monodoc SYSTEM "http://www.go-mono.org/monodoc.dtd">
<monodoc language="en">
    <class name="System.Web.UI.WebControls.CommandEventArgs" assembly="System.Web">
        <summary>TODO</summary>
        <remarks>TODO</remarks>
        <constructor name="CommandEventArgs(System.Web.UI.WebControls.CommandEventArgs)">
            <summary>TODO</summary>
            <remarks>TODO</remarks>
            <param name="e">TODO</param>
        </constructor>
        <constructor name="CommandEventArgs(System.String, System.Object)">
            <summary>TODO</summary>
            <remarks>TODO</remarks>
            <param name="commandName">TODO</param>
            <param name="argument">TODO</param>
        </constructor>
        <property name="CommandName">
            <summary>TODO</summary>
            <remarks>TODO</remarks>
            <value>TODO</value>
        </property>
        <property name="CommandArgument">
            <summary>TODO</summary>
            <remarks>TODO</remarks>
            <value>TODO</value>
        </property>
    </class>
</monodoc>