<?xml version="1.0" encoding="utf-8"?>
<!DOCTYPE monodoc SYSTEM "http://www.go-mono.org/monodoc.dtd">
<monodoc language="en">
    <class name="System.Runtime.Serialization.SerializationBinder" assembly="corlib">
        <summary>TODO</summary>
        <remarks>TODO</remarks>
        <method name="BindToType(System.String, System.String)">
            <summary>TODO</summary>
            <remarks>TODO</remarks>
            <param name="assemblyName">TODO</param>
            <param name="typeName">TODO</param>
            <returns>TODO</returns>
        </method>
    </class>
</monodoc>