<?xml version="1.0" encoding="utf-8"?>
<!DOCTYPE monodoc SYSTEM "http://www.go-mono.org/monodoc.dtd">
<monodoc language="en">
    <class name="System.Security.Cryptography.DeriveBytes" assembly="corlib">
        <summary>TODO</summary>
        <remarks>TODO</remarks>
        <method name="Reset">
            <summary>TODO</summary>
            <remarks>TODO</remarks>
            <returns>TODO</returns>
        </method>
        <method name="GetBytes(System.Int32)">
            <summary>TODO</summary>
            <remarks>TODO</remarks>
            <param name="cb">TODO</param>
            <returns>TODO</returns>
        </method>
    </class>
</monodoc>