<?xml version="1.0" encoding="utf-8"?>
<!DOCTYPE monodoc SYSTEM "http://www.go-mono.org/monodoc.dtd">
<monodoc language="en">
    <class name="System.Threading.Timer" assembly="corlib">
        <summary>TODO</summary>
        <remarks>TODO</remarks>
        <constructor name="Timer(System.Threading.TimerCallback, System.Object, System.Int32, System.Int32)">
            <summary>TODO</summary>
            <remarks>TODO</remarks>
            <param name="callback">TODO</param>
            <param name="state">TODO</param>
            <param name="dueTime">TODO</param>
            <param name="period">TODO</param>
        </constructor>
        <constructor name="Timer(System.Threading.TimerCallback, System.Object, System.Int64, System.Int64)">
            <summary>TODO</summary>
            <remarks>TODO</remarks>
            <param name="callback">TODO</param>
            <param name="state">TODO</param>
            <param name="dueTime">TODO</param>
            <param name="period">TODO</param>
        </constructor>
        <constructor name="Timer(System.Threading.TimerCallback, System.Object, System.TimeSpan, System.TimeSpan)">
            <summary>TODO</summary>
            <remarks>TODO</remarks>
            <param name="callback">TODO</param>
            <param name="state">TODO</param>
            <param name="dueTime">TODO</param>
            <param name="period">TODO</param>
        </constructor>
        <constructor name="Timer(System.Threading.TimerCallback, System.Object, System.UInt32, System.UInt32)">
            <summary>TODO</summary>
            <remarks>TODO</remarks>
            <param name="callback">TODO</param>
            <param name="state">TODO</param>
            <param name="dueTime">TODO</param>
            <param name="period">TODO</param>
        </constructor>
        <method name="Dispose">
            <summary>TODO</summary>
            <remarks>TODO</remarks>
            <returns>TODO</returns>
        </method>
        <method name="Change(System.Int32, System.Int32)">
            <summary>TODO</summary>
            <remarks>TODO</remarks>
            <param name="dueTime">TODO</param>
            <param name="period">TODO</param>
            <returns>TODO</returns>
        </method>
        <method name="Change(System.Int64, System.Int64)">
            <summary>TODO</summary>
            <remarks>TODO</remarks>
            <param name="dueTime">TODO</param>
            <param name="period">TODO</param>
            <returns>TODO</returns>
        </method>
        <method name="Change(System.TimeSpan, System.TimeSpan)">
            <summary>TODO</summary>
            <remarks>TODO</remarks>
            <param name="dueTime">TODO</param>
            <param name="period">TODO</param>
            <returns>TODO</returns>
        </method>
        <method name="Change(System.UInt32, System.UInt32)">
            <summary>TODO</summary>
            <remarks>TODO</remarks>
            <param name="dueTime">TODO</param>
            <param name="period">TODO</param>
            <returns>TODO</returns>
        </method>
        <method name="Dispose(System.Threading.WaitHandle)">
            <summary>TODO</summary>
            <remarks>TODO</remarks>
            <param name="notifyObject">TODO</param>
            <returns>TODO</returns>
        </method>
    </class>
</monodoc>