<?xml version="1.0" encoding="utf-8"?>
<!DOCTYPE monodoc SYSTEM "http://www.go-mono.org/monodoc.dtd">
<monodoc language="en">
    <class name="System.Security.NamedPermissionSet" assembly="corlib">
        <summary>TODO</summary>
        <remarks>TODO</remarks>
        <constructor name="NamedPermissionSet(System.String, System.Security.PermissionSet)">
            <summary>TODO</summary>
            <remarks>TODO</remarks>
            <param name="name">TODO</param>
            <param name="set">TODO</param>
        </constructor>
        <constructor name="NamedPermissionSet(System.String, System.Security.Permissions.PermissionState)">
            <summary>TODO</summary>
            <remarks>TODO</remarks>
            <param name="name">TODO</param>
            <param name="state">TODO</param>
        </constructor>
        <constructor name="NamedPermissionSet(System.Security.NamedPermissionSet)">
            <summary>TODO</summary>
            <remarks>TODO</remarks>
            <param name="set">TODO</param>
        </constructor>
        <constructor name="NamedPermissionSet(System.String)">
            <summary>TODO</summary>
            <remarks>TODO</remarks>
            <param name="name">TODO</param>
        </constructor>
        <property name="Description">
            <summary>TODO</summary>
            <remarks>TODO</remarks>
            <value>TODO</value>
        </property>
        <property name="Name">
            <summary>TODO</summary>
            <remarks>TODO</remarks>
            <value>TODO</value>
        </property>
        <method name="ToXml">
            <summary>TODO</summary>
            <remarks>TODO</remarks>
            <returns>TODO</returns>
        </method>
        <method name="FromXml(System.Security.SecurityElement)">
            <summary>TODO</summary>
            <remarks>TODO</remarks>
            <param name="e">TODO</param>
            <returns>TODO</returns>
        </method>
        <method name="Copy">
            <summary>TODO</summary>
            <remarks>TODO</remarks>
            <returns>TODO</returns>
        </method>
        <method name="Copy(System.String)">
            <summary>TODO</summary>
            <remarks>TODO</remarks>
            <param name="name">TODO</param>
            <returns>TODO</returns>
        </method>
    </class>
</monodoc>