<?xml version="1.0"?>
<!DOCTYPE monodoc SYSTEM "http://www.go-mono.org/monodoc.dtd">
<monodoc language="">
    <class name="System.Threading.ThreadExceptionEventArgs" assembly="System">
        <summary>TODO</summary>
        <remarks>TODO</remarks>
        <constructor name="ThreadExceptionEventArgs(System.Exception)">
            <summary>TODO</summary>
            <remarks>TODO</remarks>
            <param name="t">TODO</param>
        </constructor>
        <property name="Exception">
            <summary>TODO</summary>
            <remarks>TODO</remarks>
            <value>TODO</value>
        </property>
    </class>
</monodoc>