<?xml version="1.0" encoding="utf-8"?>
<!DOCTYPE monodoc SYSTEM "http://www.go-mono.org/monodoc.dtd">
<monodoc language="en">
    <class name="System.Runtime.InteropServices.DllImportAttribute" assembly="corlib">
        <summary>TODO</summary>
        <remarks>TODO</remarks>
        <constructor name="DllImportAttribute(System.String)">
            <summary>TODO</summary>
            <remarks>TODO</remarks>
            <param name="dllName">TODO</param>
        </constructor>
        <field name="CallingConvention">
            <summary>TODO</summary>
            <remarks>TODO</remarks>
        </field>
        <field name="CharSet">
            <summary>TODO</summary>
            <remarks>TODO</remarks>
        </field>
        <field name="EntryPoint">
            <summary>TODO</summary>
            <remarks>TODO</remarks>
        </field>
        <field name="ExactSpelling">
            <summary>TODO</summary>
            <remarks>TODO</remarks>
        </field>
        <field name="PreserveSig">
            <summary>TODO</summary>
            <remarks>TODO</remarks>
        </field>
        <field name="SetLastError">
            <summary>TODO</summary>
            <remarks>TODO</remarks>
        </field>
        <property name="Value">
            <summary>TODO</summary>
            <remarks>TODO</remarks>
            <value>TODO</value>
        </property>
    </class>
</monodoc>