<?xml version="1.0" encoding="utf-8"?>
<!DOCTYPE monodoc SYSTEM "http://www.go-mono.org/monodoc.dtd">
<monodoc language="en">
    <class name="System.Xml.XmlCharacterData" assembly="System.Xml">
        <summary>TODO</summary>
        <remarks>TODO</remarks>
        <property name="Data">
            <summary>TODO</summary>
            <remarks>TODO</remarks>
            <value>TODO</value>
        </property>
        <property name="InnerText">
            <summary>TODO</summary>
            <remarks>TODO</remarks>
            <value>TODO</value>
        </property>
        <property name="Length">
            <summary>TODO</summary>
            <remarks>TODO</remarks>
            <value>TODO</value>
        </property>
        <property name="Value">
            <summary>TODO</summary>
            <remarks>TODO</remarks>
            <value>TODO</value>
        </property>
        <method name="Substring(System.Int32, System.Int32)">
            <summary>TODO</summary>
            <remarks>TODO</remarks>
            <param name="offset">TODO</param>
            <param name="count">TODO</param>
            <returns>TODO</returns>
        </method>
        <method name="ReplaceData(System.Int32, System.Int32, System.String)">
            <summary>TODO</summary>
            <remarks>TODO</remarks>
            <param name="offset">TODO</param>
            <param name="count">TODO</param>
            <param name="strData">TODO</param>
            <returns>TODO</returns>
        </method>
        <method name="InsertData(System.Int32, System.String)">
            <summary>TODO</summary>
            <remarks>TODO</remarks>
            <param name="offset">TODO</param>
            <param name="strData">TODO</param>
            <returns>TODO</returns>
        </method>
        <method name="DeleteData(System.Int32, System.Int32)">
            <summary>TODO</summary>
            <remarks>TODO</remarks>
            <param name="offset">TODO</param>
            <param name="count">TODO</param>
            <returns>TODO</returns>
        </method>
        <method name="AppendData(System.String)">
            <summary>TODO</summary>
            <remarks>TODO</remarks>
            <param name="strData">TODO</param>
            <returns>TODO</returns>
        </method>
    </class>
</monodoc>