<?xml version="1.0"?>
<!DOCTYPE monodoc SYSTEM "http://www.go-mono.org/monodoc.dtd">
<monodoc language="">
    <class name="System.CodeDom.CodeLiteralNamespace" assembly="System">
        <summary>TODO</summary>
        <remarks>TODO</remarks>
        <constructor name="CodeLiteralNamespace(System.String)">
            <summary>TODO</summary>
            <remarks>TODO</remarks>
            <param name="value">TODO</param>
        </constructor>
        <property name="Value">
            <summary>TODO</summary>
            <remarks>TODO</remarks>
            <value>TODO</value>
        </property>
        <property name="LinePragma">
            <summary>TODO</summary>
            <remarks>TODO</remarks>
            <value>TODO</value>
        </property>
    </class>
</monodoc>