<?xml version="1.0"?>
<!DOCTYPE monodoc SYSTEM "http://www.go-mono.org/monodoc.dtd">
<monodoc language="en">
    <class name="System.Net.IPAddress" assembly="System">
        <summary>TODO</summary>
        <remarks>TODO</remarks>
        <constructor name="IPAddress(System.Int64)">
            <summary>TODO</summary>
            <remarks>TODO</remarks>
            <param name="addr">TODO</param>
        </constructor>
        <field name="Any">
            <summary>TODO</summary>
            <remarks>TODO</remarks>
        </field>
        <field name="Broadcast">
            <summary>TODO</summary>
            <remarks>TODO</remarks>
        </field>
        <field name="Loopback">
            <summary>TODO</summary>
            <remarks>TODO</remarks>
        </field>
        <field name="None">
            <summary>TODO</summary>
            <remarks>TODO</remarks>
        </field>
        <property name="Address">
            <summary>TODO</summary>
            <remarks>TODO</remarks>
            <value>TODO</value>
        </property>
        <property name="AddressFamily">
            <summary>TODO</summary>
            <remarks>TODO</remarks>
            <value>TODO</value>
        </property>
        <method name="GetHashCode">
            <summary>TODO</summary>
            <remarks>TODO</remarks>
            <returns>TODO</returns>
        </method>
        <method name="Equals(System.Object)">
            <summary>TODO</summary>
            <remarks>TODO</remarks>
            <param name="other">TODO</param>
            <returns>TODO</returns>
        </method>
        <method name="ToString">
            <summary>TODO</summary>
            <remarks>TODO</remarks>
            <returns>TODO</returns>
        </method>
        <method name="HostToNetworkOrder(System.Int16)">
            <summary>TODO</summary>
            <remarks>TODO</remarks>
            <param name="host">TODO</param>
            <returns>TODO</returns>
        </method>
        <method name="HostToNetworkOrder(System.Int32)">
            <summary>TODO</summary>
            <remarks>TODO</remarks>
            <param name="host">TODO</param>
            <returns>TODO</returns>
        </method>
        <method name="HostToNetworkOrder(System.Int64)">
            <summary>TODO</summary>
            <remarks>TODO</remarks>
            <param name="host">TODO</param>
            <returns>TODO</returns>
        </method>
        <method name="NetworkToHostOrder(System.Int16)">
            <summary>TODO</summary>
            <remarks>TODO</remarks>
            <param name="network">TODO</param>
            <returns>TODO</returns>
        </method>
        <method name="NetworkToHostOrder(System.Int32)">
            <summary>TODO</summary>
            <remarks>TODO</remarks>
            <param name="network">TODO</param>
            <returns>TODO</returns>
        </method>
        <method name="NetworkToHostOrder(System.Int64)">
            <summary>TODO</summary>
            <remarks>TODO</remarks>
            <param name="network">TODO</param>
            <returns>TODO</returns>
        </method>
        <method name="Parse(System.String)">
            <summary>TODO</summary>
            <remarks>TODO</remarks>
            <param name="ip">TODO</param>
            <returns>TODO</returns>
        </method>
        <method name="IsLoopback(System.Net.IPAddress)">
            <summary>TODO</summary>
            <remarks>TODO</remarks>
            <param name="addr">TODO</param>
            <returns>TODO</returns>
        </method>
    </class>
</monodoc>