<?xml version="1.0" encoding="utf-8"?>
<!DOCTYPE monodoc SYSTEM "http://www.go-mono.org/monodoc.dtd">
<monodoc language="en">
    <class name="System.Random" assembly="corlib">
        <summary>TODO</summary>
        <remarks>TODO</remarks>
        <constructor name="Random">
            <summary>TODO</summary>
            <remarks>TODO</remarks>
        </constructor>
        <constructor name="Random(System.Int32)">
            <summary>TODO</summary>
            <remarks>TODO</remarks>
            <param name="Seed">TODO</param>
        </constructor>
        <method name="NextDouble">
            <summary>TODO</summary>
            <remarks>TODO</remarks>
            <returns>TODO</returns>
        </method>
        <method name="NextBytes(System.Byte[])">
            <summary>TODO</summary>
            <remarks>TODO</remarks>
            <param name="buffer">TODO</param>
            <returns>TODO</returns>
        </method>
        <method name="Next(System.Int32, System.Int32)">
            <summary>TODO</summary>
            <remarks>TODO</remarks>
            <param name="minValue">TODO</param>
            <param name="maxValue">TODO</param>
            <returns>TODO</returns>
        </method>
        <method name="Next(System.Int32)">
            <summary>TODO</summary>
            <remarks>TODO</remarks>
            <param name="maxValue">TODO</param>
            <returns>TODO</returns>
        </method>
        <method name="Next">
            <summary>TODO</summary>
            <remarks>TODO</remarks>
            <returns>TODO</returns>
        </method>
    </class>
</monodoc>