<?xml version="1.0"?>
<!DOCTYPE monodoc SYSTEM "http://www.go-mono.org/monodoc.dtd">
<monodoc language="">
    <class name="System.Net.IPEndPoint" assembly="System">
        <summary>TODO</summary>
        <remarks>TODO</remarks>
        <constructor name="IPEndPoint(System.Net.IPAddress, System.Int32)">
            <summary>TODO</summary>
            <remarks>TODO</remarks>
            <param name="address">TODO</param>
            <param name="port">TODO</param>
        </constructor>
        <constructor name="IPEndPoint(System.Int64, System.Int32)">
            <summary>TODO</summary>
            <remarks>TODO</remarks>
            <param name="iaddr">TODO</param>
            <param name="port">TODO</param>
        </constructor>
        <field name="MaxPort">
            <summary>TODO</summary>
            <remarks>TODO</remarks>
        </field>
        <field name="MinPort">
            <summary>TODO</summary>
            <remarks>TODO</remarks>
        </field>
        <property name="Address">
            <summary>TODO</summary>
            <remarks>TODO</remarks>
            <value>TODO</value>
        </property>
        <property name="AddressFamily">
            <summary>TODO</summary>
            <remarks>TODO</remarks>
            <value>TODO</value>
        </property>
        <property name="Port">
            <summary>TODO</summary>
            <remarks>TODO</remarks>
            <value>TODO</value>
        </property>
        <method name="Serialize">
            <summary>TODO</summary>
            <remarks>TODO</remarks>
            <returns>TODO</returns>
        </method>
        <method name="Create(System.Net.SocketAddress)">
            <summary>TODO</summary>
            <remarks>TODO</remarks>
            <param name="sockaddr">TODO</param>
            <returns>TODO</returns>
        </method>
        <method name="ToString">
            <summary>TODO</summary>
            <remarks>TODO</remarks>
            <returns>TODO</returns>
        </method>
    </class>
</monodoc>