<?xml version="1.0" encoding="utf-8"?>
<!DOCTYPE monodoc SYSTEM "http://www.go-mono.org/monodoc.dtd">
<monodoc language="en">
    <class name="System.Security.Cryptography.DSACryptoServiceProvider" assembly="corlib">
        <summary>TODO</summary>
        <remarks>TODO</remarks>
        <constructor name="DSACryptoServiceProvider">
            <summary>TODO</summary>
            <remarks>TODO</remarks>
        </constructor>
        <constructor name="DSACryptoServiceProvider(System.Security.Cryptography.CspParameters)">
            <summary>TODO</summary>
            <remarks>TODO</remarks>
            <param name="parameters">TODO</param>
        </constructor>
        <constructor name="DSACryptoServiceProvider(System.Int32)">
            <summary>TODO</summary>
            <remarks>TODO</remarks>
            <param name="key_size">TODO</param>
        </constructor>
        <constructor name="DSACryptoServiceProvider(System.Int32, System.Security.Cryptography.CspParameters)">
            <summary>TODO</summary>
            <remarks>TODO</remarks>
            <param name="key_size">TODO</param>
            <param name="parameters">TODO</param>
        </constructor>
        <property name="KeyExchangeAlgorithm">
            <summary>TODO</summary>
            <remarks>TODO</remarks>
            <value>TODO</value>
        </property>
        <property name="KeySize">
            <summary>TODO</summary>
            <remarks>TODO</remarks>
            <value>TODO</value>
        </property>
        <property name="LegalKeySizes">
            <summary>TODO</summary>
            <remarks>TODO</remarks>
            <value>TODO</value>
        </property>
        <property name="SignatureAlgorithm">
            <summary>TODO</summary>
            <remarks>TODO</remarks>
            <value>TODO</value>
        </property>
        <property name="PersistKeyInCsp">
            <summary>TODO</summary>
            <remarks>TODO</remarks>
            <value>TODO</value>
        </property>
        <method name="VerifySignature(System.Byte[], System.Byte[])">
            <summary>TODO</summary>
            <remarks>TODO</remarks>
            <param name="hash">TODO</param>
            <param name="sig">TODO</param>
            <returns>TODO</returns>
        </method>
        <method name="ImportParameters(System.Security.Cryptography.DSAParameters)">
            <summary>TODO</summary>
            <remarks>TODO</remarks>
            <param name="parameters">TODO</param>
            <returns>TODO</returns>
        </method>
        <method name="ExportParameters(System.Boolean)">
            <summary>TODO</summary>
            <remarks>TODO</remarks>
            <param name="include">TODO</param>
            <returns>TODO</returns>
        </method>
        <method name="CreateSignature(System.Byte[])">
            <summary>TODO</summary>
            <remarks>TODO</remarks>
            <param name="rgb">TODO</param>
            <returns>TODO</returns>
        </method>
        <method name="ToXmlString(System.Boolean)">
            <summary>TODO</summary>
            <remarks>TODO</remarks>
            <param name="includePrivateParameters">TODO</param>
            <returns>TODO</returns>
        </method>
        <method name="FromXmlString(System.String)">
            <summary>TODO</summary>
            <remarks>TODO</remarks>
            <param name="xmlString">TODO</param>
            <returns>TODO</returns>
        </method>
        <method name="SignData(System.Byte[])">
            <summary>TODO</summary>
            <remarks>TODO</remarks>
            <param name="data">TODO</param>
            <returns>TODO</returns>
        </method>
        <method name="SignData(System.Byte[], System.Int32, System.Int32)">
            <summary>TODO</summary>
            <remarks>TODO</remarks>
            <param name="data">TODO</param>
            <param name="offset">TODO</param>
            <param name="count">TODO</param>
            <returns>TODO</returns>
        </method>
        <method name="SignData(System.IO.Stream)">
            <summary>TODO</summary>
            <remarks>TODO</remarks>
            <param name="data">TODO</param>
            <returns>TODO</returns>
        </method>
        <method name="SignHash(System.Byte[], System.String)">
            <summary>TODO</summary>
            <remarks>TODO</remarks>
            <param name="hash">TODO</param>
            <param name="str">TODO</param>
            <returns>TODO</returns>
        </method>
        <method name="VerifyData(System.Byte[], System.Byte[])">
            <summary>TODO</summary>
            <remarks>TODO</remarks>
            <param name="data">TODO</param>
            <param name="sig">TODO</param>
            <returns>TODO</returns>
        </method>
    </class>
</monodoc>