<?xml version="1.0" encoding="utf-8"?>
<!DOCTYPE monodoc SYSTEM "http://www.go-mono.org/monodoc.dtd">
<monodoc language="en">
    <class name="System.UriFormatException" assembly="System">
        <summary>TODO</summary>
        <remarks>TODO</remarks>
        <constructor name="UriFormatException">
            <summary>TODO</summary>
            <remarks>TODO</remarks>
        </constructor>
        <constructor name="UriFormatException(System.String)">
            <summary>TODO</summary>
            <remarks>TODO</remarks>
            <param name="message">TODO</param>
        </constructor>
    </class>
</monodoc>