<?xml version="1.0" encoding="utf-8"?>
<!DOCTYPE monodoc SYSTEM "http://www.go-mono.org/monodoc.dtd">
<monodoc language="en">
    <class name="System.Threading.Thread" assembly="corlib">
        <summary>TODO</summary>
        <remarks>TODO</remarks>
        <constructor name="Thread(System.Threading.ThreadStart)">
            <summary>TODO</summary>
            <remarks>TODO</remarks>
            <param name="start">TODO</param>
        </constructor>
        <property name="CurrentContext">
            <summary>TODO</summary>
            <remarks>TODO</remarks>
            <value>TODO</value>
        </property>
        <property name="CurrentPrincipal">
            <summary>TODO</summary>
            <remarks>TODO</remarks>
            <value>TODO</value>
        </property>
        <property name="CurrentThread">
            <summary>TODO</summary>
            <remarks>TODO</remarks>
            <value>TODO</value>
        </property>
        <property name="ApartmentState">
            <summary>TODO</summary>
            <remarks>TODO</remarks>
            <value>TODO</value>
        </property>
        <property name="CurrentCulture">
            <summary>TODO</summary>
            <remarks>TODO</remarks>
            <value>TODO</value>
        </property>
        <property name="CurrentUICulture">
            <summary>TODO</summary>
            <remarks>TODO</remarks>
            <value>TODO</value>
        </property>
        <property name="IsAlive">
            <summary>TODO</summary>
            <remarks>TODO</remarks>
            <value>TODO</value>
        </property>
        <property name="IsBackground">
            <summary>TODO</summary>
            <remarks>TODO</remarks>
            <value>TODO</value>
        </property>
        <property name="Name">
            <summary>TODO</summary>
            <remarks>TODO</remarks>
            <value>TODO</value>
        </property>
        <property name="Priority">
            <summary>TODO</summary>
            <remarks>TODO</remarks>
            <value>TODO</value>
        </property>
        <property name="ThreadState">
            <summary>TODO</summary>
            <remarks>TODO</remarks>
            <value>TODO</value>
        </property>
        <method name="AllocateDataSlot">
            <summary>TODO</summary>
            <remarks>TODO</remarks>
            <returns>TODO</returns>
        </method>
        <method name="AllocateNamedDataSlot(System.String)">
            <summary>TODO</summary>
            <remarks>TODO</remarks>
            <param name="name">TODO</param>
            <returns>TODO</returns>
        </method>
        <method name="FreeNamedDataSlot(System.String)">
            <summary>TODO</summary>
            <remarks>TODO</remarks>
            <param name="name">TODO</param>
            <returns>TODO</returns>
        </method>
        <method name="GetData(System.LocalDataStoreSlot)">
            <summary>TODO</summary>
            <remarks>TODO</remarks>
            <param name="slot">TODO</param>
            <returns>TODO</returns>
        </method>
        <method name="GetDomain">
            <summary>TODO</summary>
            <remarks>TODO</remarks>
            <returns>TODO</returns>
        </method>
        <method name="GetDomainID">
            <summary>TODO</summary>
            <remarks>TODO</remarks>
            <returns>TODO</returns>
        </method>
        <method name="GetNamedDataSlot(System.String)">
            <summary>TODO</summary>
            <remarks>TODO</remarks>
            <param name="name">TODO</param>
            <returns>TODO</returns>
        </method>
        <method name="ResetAbort">
            <summary>TODO</summary>
            <remarks>TODO</remarks>
            <returns>TODO</returns>
        </method>
        <method name="SetData(System.LocalDataStoreSlot, System.Object)">
            <summary>TODO</summary>
            <remarks>TODO</remarks>
            <param name="slot">TODO</param>
            <param name="data">TODO</param>
            <returns>TODO</returns>
        </method>
        <method name="Sleep(System.Int32)">
            <summary>TODO</summary>
            <remarks>TODO</remarks>
            <param name="millisecondsTimeout">TODO</param>
            <returns>TODO</returns>
        </method>
        <method name="Sleep(System.TimeSpan)">
            <summary>TODO</summary>
            <remarks>TODO</remarks>
            <param name="timeout">TODO</param>
            <returns>TODO</returns>
        </method>
        <method name="Abort">
            <summary>TODO</summary>
            <remarks>TODO</remarks>
            <returns>TODO</returns>
        </method>
        <method name="Abort(System.Object)">
            <summary>TODO</summary>
            <remarks>TODO</remarks>
            <param name="stateInfo">TODO</param>
            <returns>TODO</returns>
        </method>
        <method name="Interrupt">
            <summary>TODO</summary>
            <remarks>TODO</remarks>
            <returns>TODO</returns>
        </method>
        <method name="Join">
            <summary>TODO</summary>
            <remarks>TODO</remarks>
            <returns>TODO</returns>
        </method>
        <method name="Join(System.Int32)">
            <summary>TODO</summary>
            <remarks>TODO</remarks>
            <param name="millisecondsTimeout">TODO</param>
            <returns>TODO</returns>
        </method>
        <method name="Join(System.TimeSpan)">
            <summary>TODO</summary>
            <remarks>TODO</remarks>
            <param name="timeout">TODO</param>
            <returns>TODO</returns>
        </method>
        <method name="Resume">
            <summary>TODO</summary>
            <remarks>TODO</remarks>
            <returns>TODO</returns>
        </method>
        <method name="Start">
            <summary>TODO</summary>
            <remarks>TODO</remarks>
            <returns>TODO</returns>
        </method>
        <method name="Suspend">
            <summary>TODO</summary>
            <remarks>TODO</remarks>
            <returns>TODO</returns>
        </method>
    </class>
</monodoc>